{
  "parameters": {
    "subscriptionId": "3ca49042-782a-4cc9-89b5-ee1b487fe115",
    "resourceGroupName": "csmrg1696",
    "deploymentName": "csmd7411",
    "api-version": "2014-04-01-preview",
    "parameters": {
      "properties": {
        "template": "{\r\n  \"$schema\": \"http://schema.management.azure.com/schemas/2014-04-01-preview/deploymentTemplate.json#\",\r\n  \"contentVersion\": \"1.0.0.0\",\r\n  \"parameters\": {\r\n    \"siteName\": {\r\n      \"type\": \"string\",\r\n      \"metadata\": {\r\n        \"description\": \"The name of the web app that you wish to create.\"\r\n      }\r\n    },\r\n    \"hostingPlanName\": {\r\n      \"type\": \"string\",\r\n      \"metadata\": {\r\n        \"description\": \"The name of the App Service plan to use for hosting the web app.\"\r\n      }\r\n    },\r\n    \"siteLocation\": {\r\n      \"type\": \"string\",\r\n      \"metadata\": {\r\n        \"description\": \"The location to use for creating the web app and hosting plan. It must be one of the Azure locations that support web apps.\"\r\n      }\r\n    },\r\n    \"sku\": {\r\n      \"type\": \"string\",\r\n      \"allowedValues\": [\r\n        \"Free\",\r\n        \"Shared\",\r\n        \"Basic\",\r\n        \"Standard\"\r\n      ],\r\n      \"defaultValue\": \"Free\",\r\n      \"metadata\": {\r\n        \"description\": \"The pricing tier for the hosting plan.\"\r\n      }\r\n    },\r\n    \"workerSize\": {\r\n      \"type\": \"string\",\r\n      \"allowedValues\": [\r\n        \"0\",\r\n        \"1\",\r\n        \"2\"\r\n      ],\r\n      \"defaultValue\": \"0\",\r\n      \"metadata\": {\r\n        \"description\": \"The instance size of the hosting plan (small, medium, or large).\"\r\n      }\r\n    },\r\n    \"repoURL\": {\r\n      \"type\": \"string\",\r\n      \"defaultValue\": \"https://github.com/davidebbo-test/Mvc52Application.git\",\r\n      \"metadata\": {\r\n        \"description\": \"The URL for the GitHub repository that contains the project to deploy.\"\r\n      }\r\n    },\r\n    \"branch\": {\r\n      \"type\": \"string\",\r\n      \"defaultValue\": \"master\",\r\n      \"metadata\": {\r\n        \"description\": \"The branch of the GitHub repository to use.\"\r\n      }\r\n    }\r\n  },\r\n  \"resources\": [\r\n    {\r\n      \"apiVersion\": \"2015-04-01\",\r\n      \"name\": \"[parameters('hostingPlanName')]\",\r\n      \"type\": \"Microsoft.Web/serverfarms\",\r\n      \"location\": \"[parameters('siteLocation')]\",\r\n      \"properties\": {\r\n        \"name\": \"[parameters('hostingPlanName')]\",\r\n        \"sku\": \"[parameters('sku')]\",\r\n        \"workerSize\": \"[parameters('workerSize')]\",\r\n        \"numberOfWorkers\": 1\r\n      }\r\n    },\r\n    {\r\n      \"apiVersion\": \"2015-04-01\",\r\n      \"name\": \"[parameters('siteName')]\",\r\n      \"type\": \"Microsoft.Web/sites\",\r\n      \"location\": \"[parameters('siteLocation')]\",\r\n      \"dependsOn\": [\r\n        \"[resourceId('Microsoft.Web/serverfarms', parameters('hostingPlanName'))]\"\r\n      ],\r\n      \"properties\": {\r\n        \"serverFarmId\": \"[parameters('hostingPlanName')]\"\r\n      },\r\n      \"resources\": [\r\n        {\r\n          \"apiVersion\": \"2015-04-01\",\r\n          \"name\": \"web\",\r\n          \"type\": \"sourcecontrols\",\r\n          \"dependsOn\": [\r\n            \"[resourceId('Microsoft.Web/Sites', parameters('siteName'))]\"\r\n          ],\r\n          \"properties\": {\r\n            \"RepoUrl\": \"[parameters('repoURL')]\",\r\n            \"branch\": \"[parameters('branch')]\",\r\n            \"IsManualIntegration\": true\r\n          }\r\n        }\r\n      ]\r\n    }\r\n  ]\r\n}",
        "parameters": {
          "repoURL": {
            "value": "https://github.com/devigned/az-roadshow-oss.git"
          },
          "siteName": {
            "value": "csmr4068"
          },
          "hostingPlanName": {
            "value": "someplan"
          },
          "siteLocation": {
            "value": "westus"
          },
          "sku": {
            "value": "Standard"
          }
        },
        "mode": "Incremental"
      }
    }
  },
  "responses": {
    "400": {
      "body": {
        "error": {
          "code": "InvalidRequestContent",
          "message": "The request content was invalid and could not be deserialized: 'Error converting value \"{\r\n  \"$schema\": \"http://schema.management.azure.com/schemas/2014-04-01-preview/deploymentTemplate.json#\",\r\n  \"contentVersion\": \"1.0.0.0\",\r\n  \"parameters\": {\r\n    \"siteName\": {\r\n      \"type\": \"string\",\r\n      \"metadata\": {\r\n        \"description\": \"The name of the web app that you wish to create.\"\r\n      }\r\n    },\r\n    \"hostingPlanName\": {\r\n      \"type\": \"string\",\r\n      \"metadata\": {\r\n        \"description\": \"The name of the App Service plan to use for hosting the web app.\"\r\n      }\r\n    },\r\n    \"siteLocation\": {\r\n      \"type\": \"string\",\r\n      \"metadata\": {\r\n        \"description\": \"The location to use for creating the web app and hosting plan. It must be one of the Azure locations that support web apps.\"\r\n      }\r\n    },\r\n    \"sku\": {\r\n      \"type\": \"string\",\r\n      \"allowedValues\": [\r\n        \"Free\",\r\n        \"Shared\",\r\n        \"Basic\",\r\n        \"Standard\"\r\n      ],\r\n      \"defaultValue\": \"Free\",\r\n      \"metadata\": {\r\n        \"description\": \"The pricing tier for the hosting plan.\"\r\n      }\r\n    },\r\n    \"workerSize\": {\r\n      \"type\": \"string\",\r\n      \"allowedValues\": [\r\n        \"0\",\r\n        \"1\",\r\n        \"2\"\r\n      ],\r\n      \"defaultValue\": \"0\",\r\n      \"metadata\": {\r\n        \"description\": \"The instance size of the hosting plan (small, medium, or large).\"\r\n      }\r\n    },\r\n    \"repoURL\": {\r\n      \"type\": \"string\",\r\n      \"defaultValue\": \"https://github.com/davidebbo-test/Mvc52Application.git\",\r\n      \"metadata\": {\r\n        \"description\": \"The URL for the GitHub repository that contains the project to deploy.\"\r\n      }\r\n    },\r\n    \"branch\": {\r\n      \"type\": \"string\",\r\n      \"defaultValue\": \"master\",\r\n      \"metadata\": {\r\n        \"description\": \"The branch of the GitHub repository to use.\"\r\n      }\r\n    }\r\n  },\r\n  \"resources\": [\r\n    {\r\n      \"apiVersion\": \"2015-04-01\",\r\n      \"name\": \"[parameters('hostingPlanName')]\",\r\n      \"type\": \"Microsoft.Web/serverfarms\",\r\n      \"location\": \"[parameters('siteLocation')]\",\r\n      \"properties\": {\r\n        \"name\": \"[parameters('hostingPlanName')]\",\r\n        \"sku\": \"[parameters('sku')]\",\r\n        \"workerSize\": \"[parameters('workerSize')]\",\r\n        \"numberOfWorkers\": 1\r\n      }\r\n    },\r\n    {\r\n      \"apiVersion\": \"2015-04-01\",\r\n      \"name\": \"[parameters('siteName')]\",\r\n      \"type\": \"Microsoft.Web/sites\",\r\n      \"location\": \"[parameters('siteLocation')]\",\r\n      \"dependsOn\": [\r\n        \"[resourceId('Microsoft.Web/serverfarms', parameters('hostingPlanName'))]\"\r\n      ],\r\n      \"properties\": {\r\n        \"serverFarmId\": \"[parameters('hostingPlanName')]\"\r\n      },\r\n      \"resources\": [\r\n        {\r\n          \"apiVersion\": \"2015-04-01\",\r\n          \"name\": \"web\",\r\n          \"type\": \"sourcecontrols\",\r\n          \"dependsOn\": [\r\n            \"[resourceId('Microsoft.Web/Sites', parameters('siteName'))]\"\r\n          ],\r\n          \"properties\": {\r\n            \"RepoUrl\": \"[parameters('repoURL')]\",\r\n            \"branch\": \"[parameters('branch')]\",\r\n            \"IsManualIntegration\": true\r\n          }\r\n        }\r\n      ]\r\n    }\r\n  ]\r\n}\" to type 'Microsoft.WindowsAzure.ResourceStack.Frontdoor.Templates.Schema.Template'. Path 'properties.template', line 3, position 3449.'."
        }
      }
    }
  }
}